
*** Running vivado
    with args -log system_wrapper.vdi -applog -m64 -messageDb vivado.pb -mode batch -source system_wrapper.tcl -notrace


****** Vivado v2015.2 (64-bit)
  **** SW Build 1266856 on Fri Jun 26 16:35:25 MDT 2015
  **** IP Build 1264090 on Wed Jun 24 14:22:01 MDT 2015
    ** Copyright 1986-2015 Xilinx, Inc. All Rights Reserved.

source system_wrapper.tcl -notrace
Command: open_checkpoint C:/xup/embedded/2015_2_zynq_labs/lab2/lab2.runs/impl_1/system_wrapper.dcp
INFO: [Netlist 29-17] Analyzing 26 Unisim elements for replacement
INFO: [Netlist 29-28] Unisim Transformation completed in 0 CPU seconds
INFO: [Project 1-479] Netlist was created with Vivado 2015.2
INFO: [Device 21-403] Loading part xc7z010clg400-1
INFO: [Project 1-570] Preparing netlist for logic optimization
Parsing XDC File [C:/xup/embedded/2015_2_zynq_labs/lab2/lab2.runs/impl_1/.Xil/Vivado-10660-XSJPARIMALP30/dcp/system_wrapper_board.xdc]
Finished Parsing XDC File [C:/xup/embedded/2015_2_zynq_labs/lab2/lab2.runs/impl_1/.Xil/Vivado-10660-XSJPARIMALP30/dcp/system_wrapper_board.xdc]
Parsing XDC File [C:/xup/embedded/2015_2_zynq_labs/lab2/lab2.runs/impl_1/.Xil/Vivado-10660-XSJPARIMALP30/dcp/system_wrapper_early.xdc]
Finished Parsing XDC File [C:/xup/embedded/2015_2_zynq_labs/lab2/lab2.runs/impl_1/.Xil/Vivado-10660-XSJPARIMALP30/dcp/system_wrapper_early.xdc]
Reading XDEF placement.
Reading placer database...
Reading XDEF routing.
Read XDEF File: Time (s): cpu = 00:00:00 ; elapsed = 00:00:00.270 . Memory (MB): peak = 478.961 ; gain = 0.000
Restored from archive | CPU: 0.000000 secs | Memory: 0.000000 MB |
Finished XDEF File Restore: Time (s): cpu = 00:00:00 ; elapsed = 00:00:00.270 . Memory (MB): peak = 478.961 ; gain = 0.000
INFO: [Project 1-111] Unisim Transformation Summary:
No Unisim elements were transformed.

INFO: [Project 1-484] Checkpoint was created with build 1266856
open_checkpoint: Time (s): cpu = 00:00:07 ; elapsed = 00:00:08 . Memory (MB): peak = 478.961 ; gain = 285.586
Command: opt_design
Attempting to get a license for feature 'Implementation' and/or device 'xc7z010'
INFO: [Common 17-349] Got license for feature 'Implementation' and/or device 'xc7z010'
Running DRC as a precondition to command opt_design

Starting DRC Task
INFO: [DRC 23-27] Running DRC with 2 threads
INFO: [Project 1-461] DRC finished with 0 Errors
INFO: [Project 1-462] Please refer to the DRC report (report_drc) for more information.

Time (s): cpu = 00:00:00 ; elapsed = 00:00:00.110 . Memory (MB): peak = 483.438 ; gain = 1.609
INFO: [Timing 38-35] Done setting XDC timing constraints.

Starting Logic Optimization Task

Phase 1 Retarget

INFO: [Opt 31-138] Pushed 0 inverter(s) to 0 load pin(s).
INFO: [Opt 31-49] Retargeted 0 cell(s).
Phase 1 Retarget | Checksum: e1a85597

Time (s): cpu = 00:00:00 ; elapsed = 00:00:00.240 . Memory (MB): peak = 936.367 ; gain = 0.000

Phase 2 Constant Propagation
INFO: [Opt 31-138] Pushed 0 inverter(s) to 0 load pin(s).
INFO: [Opt 31-10] Eliminated 120 cells.
Phase 2 Constant Propagation | Checksum: 17fabd23f

Time (s): cpu = 00:00:00 ; elapsed = 00:00:00.590 . Memory (MB): peak = 936.367 ; gain = 0.000

Phase 3 Sweep
INFO: [Opt 31-12] Eliminated 156 unconnected nets.
INFO: [Opt 31-11] Eliminated 206 unconnected cells.
Phase 3 Sweep | Checksum: 17f0989ef

Time (s): cpu = 00:00:01 ; elapsed = 00:00:01 . Memory (MB): peak = 936.367 ; gain = 0.000

Starting Connectivity Check Task

Time (s): cpu = 00:00:00 ; elapsed = 00:00:00 . Memory (MB): peak = 936.367 ; gain = 0.000
Ending Logic Optimization Task | Checksum: 17f0989ef

Time (s): cpu = 00:00:01 ; elapsed = 00:00:01 . Memory (MB): peak = 936.367 ; gain = 0.000
Implement Debug Cores | Checksum: eef524bd
Logic Optimization | Checksum: eef524bd

Starting Power Optimization Task
INFO: [Pwropt 34-132] Skipping clock gating for clocks with a period < 3.13 ns.
Ending Power Optimization Task | Checksum: 17f0989ef

Time (s): cpu = 00:00:00 ; elapsed = 00:00:00.020 . Memory (MB): peak = 936.367 ; gain = 0.000
INFO: [Common 17-83] Releasing license: Implementation
20 Infos, 0 Warnings, 0 Critical Warnings and 0 Errors encountered.
opt_design completed successfully
opt_design: Time (s): cpu = 00:00:15 ; elapsed = 00:00:15 . Memory (MB): peak = 936.367 ; gain = 457.406
Writing placer database...
Writing XDEF routing.
Writing XDEF routing logical nets.
Writing XDEF routing special nets.
Write XDEF Complete: Time (s): cpu = 00:00:00 ; elapsed = 00:00:00.110 . Memory (MB): peak = 936.367 ; gain = 0.000
INFO: [DRC 23-27] Running DRC with 2 threads
INFO: [Coretcl 2-168] The results of DRC are in file C:/xup/embedded/2015_2_zynq_labs/lab2/lab2.runs/impl_1/system_wrapper_drc_opted.rpt.
Command: place_design
Attempting to get a license for feature 'Implementation' and/or device 'xc7z010'
INFO: [Common 17-349] Got license for feature 'Implementation' and/or device 'xc7z010'
INFO: [DRC 23-27] Running DRC with 2 threads
INFO: [Vivado_Tcl 4-198] DRC finished with 0 Errors
INFO: [Vivado_Tcl 4-199] Please refer to the DRC report (report_drc) for more information.
Running DRC as a precondition to command place_design
INFO: [DRC 23-27] Running DRC with 2 threads
INFO: [Vivado_Tcl 4-198] DRC finished with 0 Errors
INFO: [Vivado_Tcl 4-199] Please refer to the DRC report (report_drc) for more information.

Starting Placer Task
INFO: [Place 30-611] Multithreading enabled for place_design using a maximum of 2 CPUs

Phase 1 Placer Runtime Estimator
Phase 1 Placer Runtime Estimator | Checksum: e7aec7dc

Time (s): cpu = 00:00:00 ; elapsed = 00:00:00.030 . Memory (MB): peak = 936.367 ; gain = 0.000

Phase 2 Placer Initialization
Netlist sorting complete. Time (s): cpu = 00:00:00 ; elapsed = 00:00:00.010 . Memory (MB): peak = 936.367 ; gain = 0.000
Netlist sorting complete. Time (s): cpu = 00:00:00 ; elapsed = 00:00:00 . Memory (MB): peak = 936.367 ; gain = 0.000

Phase 2.1 IO Placement/ Clock Placement/ Build Placer Device

Phase 2.1.1 Pre-Place Cells
Phase 2.1.1 Pre-Place Cells | Checksum: 28af7cc3

Time (s): cpu = 00:00:00 ; elapsed = 00:00:00.080 . Memory (MB): peak = 936.367 ; gain = 0.000
WARNING: [Place 30-12] An IO Bus FIXED_IO_mio with more than one IO standard is found. Components associated with this bus are: 
	FIXED_IO_mio[53] of IOStandard LVCMOS18
	FIXED_IO_mio[52] of IOStandard LVCMOS18
	FIXED_IO_mio[51] of IOStandard LVCMOS18
	FIXED_IO_mio[50] of IOStandard LVCMOS18
	FIXED_IO_mio[49] of IOStandard LVCMOS18
	FIXED_IO_mio[48] of IOStandard LVCMOS18
	FIXED_IO_mio[47] of IOStandard LVCMOS18
	FIXED_IO_mio[46] of IOStandard LVCMOS18
	FIXED_IO_mio[45] of IOStandard LVCMOS18
	FIXED_IO_mio[44] of IOStandard LVCMOS18
	FIXED_IO_mio[43] of IOStandard LVCMOS18
	FIXED_IO_mio[42] of IOStandard LVCMOS18
	FIXED_IO_mio[41] of IOStandard LVCMOS18
	FIXED_IO_mio[40] of IOStandard LVCMOS18
	FIXED_IO_mio[39] of IOStandard LVCMOS18
	FIXED_IO_mio[38] of IOStandard LVCMOS18
	FIXED_IO_mio[37] of IOStandard LVCMOS18
	FIXED_IO_mio[36] of IOStandard LVCMOS18
	FIXED_IO_mio[35] of IOStandard LVCMOS18
	FIXED_IO_mio[34] of IOStandard LVCMOS18
	FIXED_IO_mio[33] of IOStandard LVCMOS18
	FIXED_IO_mio[32] of IOStandard LVCMOS18
	FIXED_IO_mio[31] of IOStandard LVCMOS18
	FIXED_IO_mio[30] of IOStandard LVCMOS18
	FIXED_IO_mio[29] of IOStandard LVCMOS18
	FIXED_IO_mio[28] of IOStandard LVCMOS18
	FIXED_IO_mio[27] of IOStandard LVCMOS18
	FIXED_IO_mio[26] of IOStandard LVCMOS18
	FIXED_IO_mio[25] of IOStandard LVCMOS18
	FIXED_IO_mio[24] of IOStandard LVCMOS18
	FIXED_IO_mio[23] of IOStandard LVCMOS18
	FIXED_IO_mio[22] of IOStandard LVCMOS18
	FIXED_IO_mio[21] of IOStandard LVCMOS18
	FIXED_IO_mio[20] of IOStandard LVCMOS18
	FIXED_IO_mio[19] of IOStandard LVCMOS18
	FIXED_IO_mio[18] of IOStandard LVCMOS18
	FIXED_IO_mio[17] of IOStandard LVCMOS18
	FIXED_IO_mio[16] of IOStandard LVCMOS18
	FIXED_IO_mio[15] of IOStandard LVCMOS18
	FIXED_IO_mio[14] of IOStandard LVCMOS18
	FIXED_IO_mio[13] of IOStandard LVCMOS18
	FIXED_IO_mio[12] of IOStandard LVCMOS18
	FIXED_IO_mio[11] of IOStandard LVCMOS18
	FIXED_IO_mio[10] of IOStandard LVCMOS18
	FIXED_IO_mio[9] of IOStandard LVCMOS18
	FIXED_IO_mio[8] of IOStandard LVCMOS33
	FIXED_IO_mio[7] of IOStandard LVCMOS18
	FIXED_IO_mio[6] of IOStandard LVCMOS33
	FIXED_IO_mio[5] of IOStandard LVCMOS33
	FIXED_IO_mio[4] of IOStandard LVCMOS33
	FIXED_IO_mio[3] of IOStandard LVCMOS33
	FIXED_IO_mio[2] of IOStandard LVCMOS33
	FIXED_IO_mio[1] of IOStandard LVCMOS33
	FIXED_IO_mio[0] of IOStandard LVCMOS18
INFO: [Timing 38-35] Done setting XDC timing constraints.

Phase 2.1.2 IO & Clk Clean Up
Phase 2.1.2 IO & Clk Clean Up | Checksum: 28af7cc3

Time (s): cpu = 00:00:02 ; elapsed = 00:00:01 . Memory (MB): peak = 954.375 ; gain = 18.008

Phase 2.1.3 Implementation Feasibility check On IDelay
Phase 2.1.3 Implementation Feasibility check On IDelay | Checksum: 28af7cc3

Time (s): cpu = 00:00:02 ; elapsed = 00:00:01 . Memory (MB): peak = 954.375 ; gain = 18.008

Phase 2.1.4 Commit IO Placement
Phase 2.1.4 Commit IO Placement | Checksum: 1ffff539

Time (s): cpu = 00:00:02 ; elapsed = 00:00:01 . Memory (MB): peak = 954.375 ; gain = 18.008
Phase 2.1 IO Placement/ Clock Placement/ Build Placer Device | Checksum: 58d5d61e

Time (s): cpu = 00:00:02 ; elapsed = 00:00:01 . Memory (MB): peak = 954.375 ; gain = 18.008

Phase 2.2 Build Placer Netlist Model

Phase 2.2.1 Place Init Design

Phase 2.2.1.1 Init Lut Pin Assignment
Phase 2.2.1.1 Init Lut Pin Assignment | Checksum: dcbc3036

Time (s): cpu = 00:00:02 ; elapsed = 00:00:01 . Memory (MB): peak = 954.375 ; gain = 18.008
Phase 2.2.1 Place Init Design | Checksum: 18e9b2277

Time (s): cpu = 00:00:02 ; elapsed = 00:00:02 . Memory (MB): peak = 954.375 ; gain = 18.008
Phase 2.2 Build Placer Netlist Model | Checksum: 18e9b2277

Time (s): cpu = 00:00:02 ; elapsed = 00:00:02 . Memory (MB): peak = 954.375 ; gain = 18.008

Phase 2.3 Constrain Clocks/Macros

Phase 2.3.1 Constrain Global/Regional Clocks
Phase 2.3.1 Constrain Global/Regional Clocks | Checksum: 18e9b2277

Time (s): cpu = 00:00:02 ; elapsed = 00:00:02 . Memory (MB): peak = 954.375 ; gain = 18.008
Phase 2.3 Constrain Clocks/Macros | Checksum: 18e9b2277

Time (s): cpu = 00:00:02 ; elapsed = 00:00:02 . Memory (MB): peak = 954.375 ; gain = 18.008
Phase 2 Placer Initialization | Checksum: 18e9b2277

Time (s): cpu = 00:00:02 ; elapsed = 00:00:02 . Memory (MB): peak = 954.375 ; gain = 18.008

Phase 3 Global Placement
Phase 3 Global Placement | Checksum: 1ca3af95e

Time (s): cpu = 00:00:04 ; elapsed = 00:00:02 . Memory (MB): peak = 954.375 ; gain = 18.008

Phase 4 Detail Placement

Phase 4.1 Commit Multi Column Macros
Phase 4.1 Commit Multi Column Macros | Checksum: 1ca3af95e

Time (s): cpu = 00:00:04 ; elapsed = 00:00:02 . Memory (MB): peak = 954.375 ; gain = 18.008

Phase 4.2 Commit Most Macros & LUTRAMs
Phase 4.2 Commit Most Macros & LUTRAMs | Checksum: 1c075cf82

Time (s): cpu = 00:00:04 ; elapsed = 00:00:03 . Memory (MB): peak = 954.375 ; gain = 18.008

Phase 4.3 Area Swap Optimization
Phase 4.3 Area Swap Optimization | Checksum: 184541530

Time (s): cpu = 00:00:04 ; elapsed = 00:00:03 . Memory (MB): peak = 954.375 ; gain = 18.008

Phase 4.4 updateClock Trees: DP
Phase 4.4 updateClock Trees: DP | Checksum: 184541530

Time (s): cpu = 00:00:04 ; elapsed = 00:00:03 . Memory (MB): peak = 954.375 ; gain = 18.008

Phase 4.5 Timing Path Optimizer
Phase 4.5 Timing Path Optimizer | Checksum: 2503f05c2

Time (s): cpu = 00:00:04 ; elapsed = 00:00:03 . Memory (MB): peak = 954.375 ; gain = 18.008

Phase 4.6 Small Shape Detail Placement

Phase 4.6.1 Commit Small Macros & Core Logic

Phase 4.6.1.1 setBudgets
Phase 4.6.1.1 setBudgets | Checksum: 21e084942

Time (s): cpu = 00:00:04 ; elapsed = 00:00:03 . Memory (MB): peak = 954.375 ; gain = 18.008

Phase 4.6.1.2 Commit Slice Clusters
Phase 4.6.1.2 Commit Slice Clusters | Checksum: 172854ba9

Time (s): cpu = 00:00:05 ; elapsed = 00:00:03 . Memory (MB): peak = 954.375 ; gain = 18.008
Phase 4.6.1 Commit Small Macros & Core Logic | Checksum: 172854ba9

Time (s): cpu = 00:00:05 ; elapsed = 00:00:03 . Memory (MB): peak = 954.375 ; gain = 18.008

Phase 4.6.2 Clock Restriction Legalization for Leaf Columns
Phase 4.6.2 Clock Restriction Legalization for Leaf Columns | Checksum: 172854ba9

Time (s): cpu = 00:00:05 ; elapsed = 00:00:03 . Memory (MB): peak = 954.375 ; gain = 18.008

Phase 4.6.3 Clock Restriction Legalization for Non-Clock Pins
Phase 4.6.3 Clock Restriction Legalization for Non-Clock Pins | Checksum: 172854ba9

Time (s): cpu = 00:00:05 ; elapsed = 00:00:03 . Memory (MB): peak = 954.375 ; gain = 18.008
Phase 4.6 Small Shape Detail Placement | Checksum: 172854ba9

Time (s): cpu = 00:00:05 ; elapsed = 00:00:03 . Memory (MB): peak = 954.375 ; gain = 18.008

Phase 4.7 Re-assign LUT pins
Phase 4.7 Re-assign LUT pins | Checksum: 172854ba9

Time (s): cpu = 00:00:05 ; elapsed = 00:00:03 . Memory (MB): peak = 954.375 ; gain = 18.008
Phase 4 Detail Placement | Checksum: 172854ba9

Time (s): cpu = 00:00:05 ; elapsed = 00:00:03 . Memory (MB): peak = 954.375 ; gain = 18.008

Phase 5 Post Placement Optimization and Clean-Up

Phase 5.1 PCOPT Shape updates
Phase 5.1 PCOPT Shape updates | Checksum: 1c326db63

Time (s): cpu = 00:00:05 ; elapsed = 00:00:03 . Memory (MB): peak = 954.375 ; gain = 18.008

Phase 6 Post Commit Optimization

Phase 6.1 updateClock Trees: PCOPT
Phase 6.1 updateClock Trees: PCOPT | Checksum: 1c326db63

Time (s): cpu = 00:00:05 ; elapsed = 00:00:03 . Memory (MB): peak = 954.375 ; gain = 18.008

Phase 6.2 Post Placement Optimization

Phase 6.2.1 Post Placement Timing Optimization
INFO: [Place 30-746] Post Placement Timing Summary WNS=3.969. For the most accurate timing information please run report_timing.
Phase 6.2.1 Post Placement Timing Optimization | Checksum: 1e5ac03d9

Time (s): cpu = 00:00:05 ; elapsed = 00:00:04 . Memory (MB): peak = 954.375 ; gain = 18.008
Phase 6.2 Post Placement Optimization | Checksum: 1e5ac03d9

Time (s): cpu = 00:00:05 ; elapsed = 00:00:04 . Memory (MB): peak = 954.375 ; gain = 18.008
Phase 6 Post Commit Optimization | Checksum: 1e5ac03d9

Time (s): cpu = 00:00:05 ; elapsed = 00:00:04 . Memory (MB): peak = 954.375 ; gain = 18.008

Phase 5.2 Sweep Clock Roots: Post-Placement
Phase 5.2 Sweep Clock Roots: Post-Placement | Checksum: 1e5ac03d9

Time (s): cpu = 00:00:06 ; elapsed = 00:00:04 . Memory (MB): peak = 954.375 ; gain = 18.008

Phase 5.3 Post Placement Cleanup
Phase 5.3 Post Placement Cleanup | Checksum: 1e5ac03d9

Time (s): cpu = 00:00:06 ; elapsed = 00:00:04 . Memory (MB): peak = 954.375 ; gain = 18.008

Phase 5.4 Placer Reporting

Phase 5.4.1 Restore STA
Phase 5.4.1 Restore STA | Checksum: 1e5ac03d9

Time (s): cpu = 00:00:06 ; elapsed = 00:00:04 . Memory (MB): peak = 954.375 ; gain = 18.008
Phase 5.4 Placer Reporting | Checksum: 1e5ac03d9

Time (s): cpu = 00:00:06 ; elapsed = 00:00:04 . Memory (MB): peak = 954.375 ; gain = 18.008

Phase 5.5 Final Placement Cleanup
Phase 5.5 Final Placement Cleanup | Checksum: 1c200078b

Time (s): cpu = 00:00:06 ; elapsed = 00:00:04 . Memory (MB): peak = 954.375 ; gain = 18.008
Phase 5 Post Placement Optimization and Clean-Up | Checksum: 1c200078b

Time (s): cpu = 00:00:06 ; elapsed = 00:00:04 . Memory (MB): peak = 954.375 ; gain = 18.008
Ending Placer Task | Checksum: 16014ea9d

Time (s): cpu = 00:00:06 ; elapsed = 00:00:04 . Memory (MB): peak = 954.375 ; gain = 18.008
INFO: [Common 17-83] Releasing license: Implementation
33 Infos, 1 Warnings, 0 Critical Warnings and 0 Errors encountered.
place_design completed successfully
Writing placer database...
Writing XDEF routing.
Writing XDEF routing logical nets.
Writing XDEF routing special nets.
Write XDEF Complete: Time (s): cpu = 00:00:01 ; elapsed = 00:00:00.310 . Memory (MB): peak = 954.375 ; gain = 0.000
report_io: Time (s): cpu = 00:00:00 ; elapsed = 00:00:00.060 . Memory (MB): peak = 954.375 ; gain = 0.000
report_utilization: Time (s): cpu = 00:00:00 ; elapsed = 00:00:00.060 . Memory (MB): peak = 954.375 ; gain = 0.000
report_control_sets: Time (s): cpu = 00:00:00 ; elapsed = 00:00:00.010 . Memory (MB): peak = 954.375 ; gain = 0.000
Command: route_design
Attempting to get a license for feature 'Implementation' and/or device 'xc7z010'
INFO: [Common 17-349] Got license for feature 'Implementation' and/or device 'xc7z010'
Running DRC as a precondition to command route_design
INFO: [DRC 23-27] Running DRC with 2 threads
WARNING: [DRC 23-20] Rule violation (PLIO-7) Placement Constraints Check for IO constraints - An IO Bus FIXED_IO_mio[53:0] with more than one IO standard is found. Components associated with this bus are:  FIXED_IO_mio[53] of IOStandard LVCMOS18; FIXED_IO_mio[52] of IOStandard LVCMOS18; FIXED_IO_mio[51] of IOStandard LVCMOS18; FIXED_IO_mio[50] of IOStandard LVCMOS18; FIXED_IO_mio[49] of IOStandard LVCMOS18; FIXED_IO_mio[48] of IOStandard LVCMOS18; FIXED_IO_mio[47] of IOStandard LVCMOS18; FIXED_IO_mio[46] of IOStandard LVCMOS18; FIXED_IO_mio[45] of IOStandard LVCMOS18; FIXED_IO_mio[44] of IOStandard LVCMOS18; FIXED_IO_mio[43] of IOStandard LVCMOS18; FIXED_IO_mio[42] of IOStandard LVCMOS18; FIXED_IO_mio[41] of IOStandard LVCMOS18; FIXED_IO_mio[40] of IOStandard LVCMOS18; FIXED_IO_mio[39] of IOStandard LVCMOS18; FIXED_IO_mio[38] of IOStandard LVCMOS18; FIXED_IO_mio[37] of IOStandard LVCMOS18; FIXED_IO_mio[36] of IOStandard LVCMOS18; FIXED_IO_mio[35] of IOStandard LVCMOS18; FIXED_IO_mio[34] of IOStandard LVCMOS18; FIXED_IO_mio[33] of IOStandard LVCMOS18; FIXED_IO_mio[32] of IOStandard LVCMOS18; FIXED_IO_mio[31] of IOStandard LVCMOS18; FIXED_IO_mio[30] of IOStandard LVCMOS18; FIXED_IO_mio[29] of IOStandard LVCMOS18; FIXED_IO_mio[28] of IOStandard LVCMOS18; FIXED_IO_mio[27] of IOStandard LVCMOS18; FIXED_IO_mio[26] of IOStandard LVCMOS18; FIXED_IO_mio[25] of IOStandard LVCMOS18; FIXED_IO_mio[24] of IOStandard LVCMOS18; FIXED_IO_mio[23] of IOStandard LVCMOS18; FIXED_IO_mio[22] of IOStandard LVCMOS18; FIXED_IO_mio[21] of IOStandard LVCMOS18; FIXED_IO_mio[20] of IOStandard LVCMOS18; FIXED_IO_mio[19] of IOStandard LVCMOS18; FIXED_IO_mio[18] of IOStandard LVCMOS18; FIXED_IO_mio[17] of IOStandard LVCMOS18; FIXED_IO_mio[16] of IOStandard LVCMOS18; FIXED_IO_mio[15] of IOStandard LVCMOS18; FIXED_IO_mio[14] of IOStandard LVCMOS18; FIXED_IO_mio[13] of IOStandard LVCMOS18; FIXED_IO_mio[12] of IOStandard LVCMOS18; FIXED_IO_mio[11] of IOStandard LVCMOS18; FIXED_IO_mio[10] of IOStandard LVCMOS18; FIXED_IO_mio[9] of IOStandard LVCMOS18; FIXED_IO_mio[8] of IOStandard LVCMOS33; FIXED_IO_mio[7] of IOStandard LVCMOS18; FIXED_IO_mio[6] of IOStandard LVCMOS33; FIXED_IO_mio[5] of IOStandard LVCMOS33; FIXED_IO_mio[4] of IOStandard LVCMOS33; FIXED_IO_mio[3] of IOStandard LVCMOS33; FIXED_IO_mio[2] of IOStandard LVCMOS33; FIXED_IO_mio[1] of IOStandard LVCMOS33; FIXED_IO_mio[0] of IOStandard LVCMOS18;
INFO: [Vivado_Tcl 4-198] DRC finished with 0 Errors, 1 Warnings
INFO: [Vivado_Tcl 4-199] Please refer to the DRC report (report_drc) for more information.


Starting Routing Task
INFO: [Route 35-254] Multithreading enabled for route_design using a maximum of 2 CPUs

Phase 1 Build RT Design
Phase 1 Build RT Design | Checksum: 142fbae4f

Time (s): cpu = 00:00:17 ; elapsed = 00:00:16 . Memory (MB): peak = 995.285 ; gain = 40.910

Phase 2 Router Initialization

Phase 2.1 Create Timer
Phase 2.1 Create Timer | Checksum: 142fbae4f

Time (s): cpu = 00:00:17 ; elapsed = 00:00:16 . Memory (MB): peak = 997.672 ; gain = 43.297

Phase 2.2 Pre Route Cleanup
Phase 2.2 Pre Route Cleanup | Checksum: 142fbae4f

Time (s): cpu = 00:00:17 ; elapsed = 00:00:16 . Memory (MB): peak = 1005.016 ; gain = 50.641
 Number of Nodes with overlaps = 0

Phase 2.3 Update Timing
Phase 2.3 Update Timing | Checksum: 247445e66

Time (s): cpu = 00:00:18 ; elapsed = 00:00:16 . Memory (MB): peak = 1013.336 ; gain = 58.961
INFO: [Route 35-57] Estimated Timing Summary | WNS=3.952  | TNS=0.000  | WHS=-0.156 | THS=-18.354|

Phase 2 Router Initialization | Checksum: 195780de4

Time (s): cpu = 00:00:19 ; elapsed = 00:00:16 . Memory (MB): peak = 1013.336 ; gain = 58.961

Phase 3 Initial Routing
Phase 3 Initial Routing | Checksum: 109a01dc4

Time (s): cpu = 00:00:19 ; elapsed = 00:00:17 . Memory (MB): peak = 1013.336 ; gain = 58.961

Phase 4 Rip-up And Reroute

Phase 4.1 Global Iteration 0
 Number of Nodes with overlaps = 92
 Number of Nodes with overlaps = 1
 Number of Nodes with overlaps = 0

Phase 4.1.1 Update Timing
Phase 4.1.1 Update Timing | Checksum: 1b7c93b3c

Time (s): cpu = 00:00:19 ; elapsed = 00:00:17 . Memory (MB): peak = 1013.336 ; gain = 58.961
INFO: [Route 35-57] Estimated Timing Summary | WNS=3.794  | TNS=0.000  | WHS=N/A    | THS=N/A    |

Phase 4.1 Global Iteration 0 | Checksum: 109837df3

Time (s): cpu = 00:00:19 ; elapsed = 00:00:17 . Memory (MB): peak = 1013.336 ; gain = 58.961

Phase 4.2 Global Iteration 1
 Number of Nodes with overlaps = 0

Phase 4.2.1 Update Timing
Phase 4.2.1 Update Timing | Checksum: 1da89648d

Time (s): cpu = 00:00:19 ; elapsed = 00:00:17 . Memory (MB): peak = 1013.336 ; gain = 58.961
INFO: [Route 35-57] Estimated Timing Summary | WNS=3.794  | TNS=0.000  | WHS=N/A    | THS=N/A    |

Phase 4.2 Global Iteration 1 | Checksum: 214560511

Time (s): cpu = 00:00:20 ; elapsed = 00:00:17 . Memory (MB): peak = 1013.336 ; gain = 58.961
Phase 4 Rip-up And Reroute | Checksum: 214560511

Time (s): cpu = 00:00:20 ; elapsed = 00:00:17 . Memory (MB): peak = 1013.336 ; gain = 58.961

Phase 5 Delay and Skew Optimization

Phase 5.1 Delay CleanUp

Phase 5.1.1 Update Timing
Phase 5.1.1 Update Timing | Checksum: 1428b136a

Time (s): cpu = 00:00:20 ; elapsed = 00:00:17 . Memory (MB): peak = 1013.336 ; gain = 58.961
INFO: [Route 35-57] Estimated Timing Summary | WNS=3.794  | TNS=0.000  | WHS=N/A    | THS=N/A    |

Phase 5.1 Delay CleanUp | Checksum: 1428b136a

Time (s): cpu = 00:00:20 ; elapsed = 00:00:17 . Memory (MB): peak = 1013.336 ; gain = 58.961

Phase 5.2 Clock Skew Optimization
Phase 5.2 Clock Skew Optimization | Checksum: 1428b136a

Time (s): cpu = 00:00:20 ; elapsed = 00:00:17 . Memory (MB): peak = 1013.336 ; gain = 58.961
Phase 5 Delay and Skew Optimization | Checksum: 1428b136a

Time (s): cpu = 00:00:20 ; elapsed = 00:00:17 . Memory (MB): peak = 1013.336 ; gain = 58.961

Phase 6 Post Hold Fix

Phase 6.1 Update Timing
Phase 6.1 Update Timing | Checksum: 2281b7390

Time (s): cpu = 00:00:20 ; elapsed = 00:00:17 . Memory (MB): peak = 1013.336 ; gain = 58.961
INFO: [Route 35-57] Estimated Timing Summary | WNS=3.794  | TNS=0.000  | WHS=0.055  | THS=0.000  |

Phase 6 Post Hold Fix | Checksum: 1d4d3f3c6

Time (s): cpu = 00:00:20 ; elapsed = 00:00:17 . Memory (MB): peak = 1013.336 ; gain = 58.961

Phase 7 Route finalize

Router Utilization Summary
  Global Vertical Routing Utilization    = 0.393722 %
  Global Horizontal Routing Utilization  = 0.64545 %
  Routable Net Status*
  *Does not include unroutable nets such as driverless and loadless.
  Run report_route_status for detailed report.
  Number of Failed Nets               = 0
  Number of Unrouted Nets             = 0
  Number of Partially Routed Nets     = 0
  Number of Node Overlaps             = 0

Phase 7 Route finalize | Checksum: 21fb8e62c

Time (s): cpu = 00:00:20 ; elapsed = 00:00:17 . Memory (MB): peak = 1013.336 ; gain = 58.961

Phase 8 Verifying routed nets

 Verification completed successfully
Phase 8 Verifying routed nets | Checksum: 21fb8e62c

Time (s): cpu = 00:00:20 ; elapsed = 00:00:17 . Memory (MB): peak = 1013.484 ; gain = 59.109

Phase 9 Depositing Routes
Phase 9 Depositing Routes | Checksum: 19b468a65

Time (s): cpu = 00:00:20 ; elapsed = 00:00:17 . Memory (MB): peak = 1013.484 ; gain = 59.109

Phase 10 Post Router Timing
INFO: [Route 35-57] Estimated Timing Summary | WNS=3.794  | TNS=0.000  | WHS=0.055  | THS=0.000  |

INFO: [Route 35-327] The final timing numbers are based on the router estimated timing analysis. For a complete and accurate timing signoff, please run report_timing_summary.
Phase 10 Post Router Timing | Checksum: 19b468a65

Time (s): cpu = 00:00:20 ; elapsed = 00:00:17 . Memory (MB): peak = 1013.484 ; gain = 59.109
INFO: [Route 35-16] Router Completed Successfully

Time (s): cpu = 00:00:20 ; elapsed = 00:00:17 . Memory (MB): peak = 1013.484 ; gain = 59.109

Routing Is Done.
INFO: [Common 17-83] Releasing license: Implementation
47 Infos, 2 Warnings, 0 Critical Warnings and 0 Errors encountered.
route_design completed successfully
route_design: Time (s): cpu = 00:00:21 ; elapsed = 00:00:18 . Memory (MB): peak = 1013.484 ; gain = 59.109
Writing placer database...
Writing XDEF routing.
Writing XDEF routing logical nets.
Writing XDEF routing special nets.
Write XDEF Complete: Time (s): cpu = 00:00:01 ; elapsed = 00:00:00.350 . Memory (MB): peak = 1013.484 ; gain = 0.000
INFO: [DRC 23-27] Running DRC with 2 threads
INFO: [Coretcl 2-168] The results of DRC are in file C:/xup/embedded/2015_2_zynq_labs/lab2/lab2.runs/impl_1/system_wrapper_drc_routed.rpt.
INFO: [Timing 38-91] UpdateTimingParams: Speed grade: -1, Delay Type: min_max.
INFO: [Timing 38-191] Multithreading enabled for timing update using a maximum of 2 CPUs
Running Vector-less Activity Propagation...

Finished Running Vector-less Activity Propagation
Attempting to get a license for feature 'Implementation' and/or device 'xc7z010'
INFO: [Common 17-349] Got license for feature 'Implementation' and/or device 'xc7z010'
Running DRC as a precondition to command write_bitstream
INFO: [DRC 23-27] Running DRC with 2 threads
INFO: [Vivado 12-3199] DRC finished with 0 Errors
INFO: [Vivado 12-3200] Please refer to the DRC report (report_drc) for more information.
Loading data files...
Loading site data...
Loading route data...
Processing options...
Creating bitmap...
Creating bitstream...
Writing bitstream ./system_wrapper.bit...
INFO: [Vivado 12-1842] Bitgen Completed Successfully.
INFO: [Project 1-118] WebTalk data collection is enabled (User setting is ON. Install Setting is ON.).
INFO: [Common 17-83] Releasing license: Implementation
write_bitstream: Time (s): cpu = 00:00:20 ; elapsed = 00:00:20 . Memory (MB): peak = 1350.301 ; gain = 323.426
INFO: [Common 17-206] Exiting Vivado at Thu Jul 30 15:31:02 2015...
